{
  "budget": {
    "scope": "group",
    "wall_seconds": 9000
  },
  "evaluation_suite": {
    "id": "occt-visible5",
    "version": "1"
  },
  "execution_mode": "joint",
  "has_hidden_checks": false,
  "id": "occt_boolean_group_visible_370_872_1452",
  "kind": "group",
  "members": [
    {
      "issue_id": "occt-370",
      "issue_version": "1"
    },
    {
      "issue_id": "occt-872",
      "issue_version": "1"
    },
    {
      "issue_id": "occt-1452",
      "issue_version": "1"
    }
  ],
  "required_outputs": [
    "patch.diff",
    "report.md"
  ],
  "schema_version": 1,
  "source_id": "occt-3e80fad1779e",
  "title": "旧题 · OCCT 370 / 872 / 1452 · 组合题",
  "version": "1"
}
