{
  "budget": {
    "scope": "group",
    "wall_seconds": 7200
  },
  "evaluation_suite": {
    "id": "occt-active-544",
    "version": "1"
  },
  "execution_mode": "joint",
  "has_hidden_checks": true,
  "id": "occt_boolean_active_visible_544",
  "kind": "active",
  "members": [
    {
      "issue_id": "occt-544",
      "issue_version": "1"
    }
  ],
  "required_outputs": [
    "patch.diff",
    "report.md",
    "findings.jsonl"
  ],
  "schema_version": 1,
  "source_id": "occt-3e80fad1779e",
  "title": "旧题 · OCCT 544 · 主动题",
  "version": "1"
}
