{
  "budget": {
    "scope": "group",
    "wall_seconds": 7200
  },
  "evaluation_suite": {
    "id": "NG-05T-v1-checks",
    "version": "1"
  },
  "execution_mode": "joint",
  "has_hidden_checks": true,
  "id": "NG-05T-v1",
  "kind": "group",
  "members": [
    {
      "issue_id": "mantis-30082",
      "issue_version": "4"
    },
    {
      "issue_id": "mantis-31602",
      "issue_version": "2"
    },
    {
      "issue_id": "mantis-32850",
      "issue_version": "1"
    }
  ],
  "required_outputs": [
    "patch.diff",
    "report.md"
  ],
  "schema_version": 1,
  "source_id": "occt-ng04t-v1-baseline-ef5af939",
  "title": "OCCT · 30082 / 31602 / 32850",
  "version": "1"
}
