{
  "schema_version": 1,
  "id": "manual-box-a-single",
  "version": "1",
  "title": "Manual example · Box A",
  "kind": "single",
  "source_id": "occt-3e80fad1779e",
  "execution_mode": "joint",
  "members": [{"issue_id": "manual-box-a", "issue_version": "1"}],
  "budget": {"scope": "group", "wall_seconds": 1800},
  "required_outputs": ["patch.diff", "report.md"],
  "evaluation_suite": {"id": "manual-box-a-suite", "version": "1"},
  "has_hidden_checks": false
}
